name,description,module,path
"brainstorming","Facilitate interactive brainstorming sessions using diverse creative techniques and ideation methods","core","_bmad/core/workflows/brainstorming/workflow.md"
"party-mode","Orchestrates group discussions between all installed BMAD agents, enabling natural multi-agent conversations","core","_bmad/core/workflows/party-mode/workflow.md"
"agent","Tri-modal workflow for creating, editing, and validating BMAD Core compliant agents","bmb","_bmad/bmb/workflows/agent/workflow.md"
"create-module","Interactive workflow to build complete BMAD modules with agents, workflows, and installation infrastructure","bmb","_bmad/bmb/workflows/create-module/workflow.md"
"Meal Prep & Nutrition Plan","Creates personalized meal plans through collaborative nutrition planning between an expert facilitator and individual seeking to improve their nutrition habits.","bmb","_bmad/bmb/workflows/create-workflow/data/examples/meal-prep-nutrition/workflow.md"
"create-workflow","Create structured standalone workflows using markdown-based step architecture","bmb","_bmad/bmb/workflows/create-workflow/workflow.md"
"edit-workflow","Intelligent workflow editor that helps modify existing workflows while following best practices","bmb","_bmad/bmb/workflows/edit-workflow/workflow.md"
"workflow-compliance-check","Systematic validation of workflows against BMAD standards with adversarial analysis and detailed reporting","bmb","_bmad/bmb/workflows/workflow-compliance-check/workflow.md"
